title,author,company,abstract
Cloud Health Resource Sharing Based on Consensus-Oriented Blockchain Technology: Case Study on a Breast Tumor Diagnosis Service,"Xiaobao Zhu, Jing Shi, Cuiyuan Lu",J Med Internet Res 2019;21(7):e13767,"Background: In recent years, researchers have made significant efforts in advancing blockchain technology. This technology, with distinct features of decentralization and security, can be applied to many fields. In areas of health data and resource sharing, applications of blockchain technology are also emerging.Objective: In this study, we propose a cloud health resource-sharing model based on consensus-oriented blockchain technology and have developed a simulation study on breast tumor diagnosis.Methods: The proposed platform is built on a consortium or federated blockchain that possesses features of both centralization and decentralization. The consensus mechanisms generate operating standards for the proposed model. Open source Ethereum code is employed to provide the blockchain environment. Proof of Authority is selected as the consensus algorithm of block generation.Results: Based on the proposed model, a simulation case study for breast tumor classification is constructed. The simulation includes 9893 service requests from 100 users; 22 service providers are equipped with 22 different classification methods. Each request is fulfilled by a service provider recommended by the weighted k-nearest neighbors (KNN) algorithm. The majority of service requests are handled by 9 providers, and provider service evaluation scores tend to stabilize. Also, user priority on KNN weights significantly affects the system operation outcome.Conclusions: The proposed model is feasible based on the simulation case study for the cloud service of breast tumor diagnosis and has the potential to be applied to other applications."
Supporting Heart Failure Patient Transitions From Acute to Community Care With Home Telemonitoring Technology: A Protocol for a Provincial Randomized Controlled Trial (TEC4Home),Lynn TEC4Home Healthcare Innovation Community,JMIR Res Protoc 2016;5(4):e198,"Background: Seniors with chronic diseases such as heart failure have complex care needs. They are vulnerable to their condition deteriorating and, without timely intervention, may require multiple emergency department visits and/or repeated hospitalizations. Upon discharge, the transition from the emergency department to home can be a vulnerable time for recovering patients with disruptions in the continuity of care. Remote monitoring of heart failure patients using home telemonitoring, coupled with clear communication protocols between health care professionals, can be effective in increasing the safety and quality of care for seniors with heart failure discharged from the emergency department.Objective: The aim of the Telehealth for Emergency-Community Continuity of Care Connectivity via Home Telemonitoring (TEC4Home) study is to generate evidence through a programmatic evaluation and a clinical trial to determine how home telemonitoring may improve care and increase patient safety during the transition of care and determine how it is best implemented to support patients with heart failure within this context.Methods: This 4-year project consists of 3 studies to comprehensively evaluate the outcomes and effectiveness of TEC4Home. Study 1 is a feasibility study with 90 patients recruited from 2 emergency department sites to test implementation and evaluation procedures. Findings from the feasibility study will be used to refine protocols for the larger trial. Study 2 is a cluster randomized controlled trial that will include 30 emergency department sites and 900 patients across British Columbia. The primary outcome of the randomized controlled trial will be emergency department revisits and hospital readmission rates. Secondary outcomes include health care resource utilization/costs, communication between members of the care team, and patient quality of life. Study 3 will run concurrently to study 2 and test the effectiveness of predictive analytic software to detect patient deterioration sooner.Results: It is hypothesized that TEC4Home will be a cost-effective strategy to decrease 90-day emergency department revisits and hospital admission rates and improve comfort and quality of life for seniors with heart failure. The results from this project will also help establish an innovation pathway for rapid and rigorous introduction of innovation into the health system.Conclusions: While there is some evidence about the effectiveness of home telemonitoring for some patients and conditions, the TEC4Home project will be one of the first protocols that implements and evaluates the technology for patients with heart failure as they transition from the emergency department to home care. The results from this research are expected to inform the full scale and spread of the home monitoring approach throughout British Columbia and Canada and to other chronic diseases.Trial Registration: ClinicalTrials.gov NCT02821065; https://clinicaltrials.gov/ct2/show/NCT02821065 (Archived by WebCite at http://www.webcitation.org/6ml2iwKax)"
Using Blockchain to Create Transaction Identity for Persons Experiencing Homelessness in America: Policy Proposal,"Anjum Khurshid, Ashish Gadnis",JMIR Res Protoc 2019;8(3):e10654,"unstructured: More than 500,000 people experience homelessness in America each day. Local and federal solutions to the problem have had limited success because of the fragmentation of services and lack of valid and timely information. Billions of dollars spent to provide reliable, timely, and actionable information in health care have exposed the difficulty of establishing such a system using the prevalent information technology solutions. However, relying on successful examples of the use of blockchain to help refugee populations and poor farmers internationally, we have partnered to propose an innovative solution to this problem using the case of people experiencing homelessness in Austin, Texas. This paper aims to describe one of the first applications of blockchain technology for addressing homelessness in the United States by creating a digital identity for people experiencing homelessness and engaging emergency medical services and clinical providers. The authors argue that a lack of documentation to prove personal identity and the inability to access own records are major hurdles for empowering persons experiencing homelessness to be resilient and overcome the life challenges they face. Furthermore, it is argued that this lack of information causes misdiagnosis, duplication, and fragmentation in service delivery, which can be potentially addressed by blockchain technology. Further planning for creating a program on the ground with additional funding will demonstrate the results of using blockchain technology to establish digital identity for persons experiencing homelessness."
Blockchain-Enabled iWellChain Framework Integration With the National Medical Referral System: Development and Usability Study,"Yu-Sheng Lo, Cheng-Yi Yang, Hsiung-Fei Chien, Shy-Shin Chang, Chung-Ying Lu, Ray-Jade Chen",J Med Internet Res 2019;21(12):e13563,"Background: Medical referral is the transfer of a patient’s care from one physician to another upon request. This process involves multiple steps that require provider-to-provider and provider-to-patient communication. In Taiwan, the National Health Insurance Administration (NHIA) has implemented a national medical referral (NMR) system, which encourages physicians to refer their patients to different health care facilities to reduce unnecessary hospital visits and the financial stress on the national health insurance. However, the NHIA’s NMR system is a government-based electronic medical referral service, and its referral data access and exchange are limited to authorized clinical professionals using their national health smart cards over the NHIA virtual private network. Therefore, this system lacks scalability and flexibility and cannot establish trusting relationships among patients, family doctors, and specialists.Objective: To eliminate the existing restrictions of the NHIA’s NMR system, this study developed a scalable, flexible, and blockchain-enabled framework that leverages the NHIA’s NMR referral data to build an alliance-based medical referral service connecting health care facilities.Methods: We developed a blockchain-enabled framework that can integrate patient referral data from the NHIA’s NMR system with electronic medical record (EMR) and electronic health record (EHR) data of hospitals and community-based clinics to establish an alliance-based medical referral service serving patients, clinics, and hospitals and improve the trust in relationships and transaction security. We also developed a blockchain-enabled personal health record decentralized app (DApp) based on our blockchain-enabled framework for patients to acquire their EMR and EHR data; DApp access logs were collected to assess patients’ behavior and investigate the acceptance of our personal authorization-controlled framework.Results: The constructed iWellChain Framework was installed in an affiliated teaching hospital and four collaborative clinics. The framework renders all medical referral processes automatic and paperless and facilitates efficient NHIA reimbursements. In addition, the blockchain-enabled iWellChain DApp was distributed for patients to access and control their EMR and EHR data. Analysis of 3 months (September to December 2018) of access logs revealed that patients were highly interested in acquiring health data, especially those of laboratory test reports.Conclusions: This study is a pioneer of blockchain applications for medical referral services, and the constructed framework and DApp have been applied practically in clinical settings. The iWellChain Framework has the scalability to deploy a blockchain environment effectively for health care facilities; the iWellChain DApp has potential for use with more patient-centered applications to collaborate with the industry and facilitate its adoption."
"Conversational Interfaces for Health: Bibliometric Analysis of Grants, Publications, and Patents","Zhaopeng Xing, Fei Yu, Jian Du, Jennifer S. Walker, Claire B. Paulson, Nandita S. Mani, Lixin Song",J Med Internet Res 2019;21(11):e14672,"Background: Conversational interfaces (CIs) in different modalities have been developed for health purposes, such as health behavioral intervention, patient self-management, and clinical decision support. Despite growing research evidence supporting CIs’ potential, CI-related research is still in its infancy. There is a lack of systematic investigation that goes beyond publication review and presents the state of the art from perspectives of funding agencies, academia, and industry by incorporating CI-related public funding and patent activities.Objective: This study aimed to use data systematically extracted from multiple sources (ie, grant, publication, and patent databases) to investigate the development, research, and fund application of health-related CIs and associated stakeholders (ie, countries, organizations, and collaborators).Methods: A multifaceted search query was executed to retrieve records from 9 databases. Bibliometric analysis, social network analysis, and term co-occurrence analysis were conducted on the screened records.Results: This review included 42 funded projects, 428 research publications, and 162 patents. The total dollar amount of grants awarded was US $30,297,932, of which US $13,513,473 was awarded by US funding agencies and US $16,784,459 was funded by the Europe Commission. The top 3 funding agencies in the United States were the National Science Foundation, National Institutes of Health, and Agency for Healthcare Research and Quality. Boston Medical Center was awarded the largest combined grant size (US $2,246,437) for 4 projects. The authors of the publications were from 58 countries and 566 organizations; the top 3 most productive organizations were Northeastern University (United States), Universiti Teknologi MARA (Malaysia), and the French National Center for Scientific Research (CNRS; France). US researchers produced 114 publications. Although 82.0% (464/566) of the organizations engaged in interorganizational collaboration, 2 organizational research-collaboration clusters were observed with Northeastern University and CNRS as the central nodes. About 112 organizations from the United States and China filed 87.7% patents. IBM filed most patents (N=17). Only 5 patents were co-owned by different organizations, and there was no across-country collaboration on patenting activity. The terms patient, child, elderly, and robot were frequently discussed in the 3 record types. The terms related to mental and chronic issues were discussed mainly in grants and publications. The terms regarding multimodal interactions were widely mentioned as users’ communication modes with CIs in the identified records.Conclusions: Our findings provided an overview of the countries, organizations, and topic terms in funded projects, as well as the authorship, collaboration, content, and related information of research publications and patents. There is a lack of broad cross-sector partnerships among grant agencies, academia, and industry, particularly in the United States. Our results suggest a need to improve collaboration among public and private sectors and health care organizations in research and patent activities."
The Impact of a Social Networking Service–Enhanced Smart Care Model on Stage 5 Chronic Kidney Disease: Quasi-Experimental Study,"Feng-Jung Yang, Ying-Hui Hou, Ray-E Chang",J Med Internet Res 2020;22(4):e15565,"Background: Stage 5 chronic kidney disease (CKD) presents a high risk for dialysis initiation and for complications such as uremic encephalopathy, uremic symptoms, gastrointestinal bleeding, and infection. One of the most common barriers to health care for patients with stage 5 CKD is poor continuity of care due to unresolved communication gaps.Objective: Our aim was to establish a powerful care model that includes the use of a social networking service (SNS) to improve care quality for patients with CKD and safely delay dialysis initiation.Methods: We used a retrospective cohort of CKD patients aged 20-85 years who received care between 2007 and 2017 to evaluate the efficacy of incorporating an SNS into the health care system. In 2014, author F-JY, a nephrologist at the National Taiwan University Hospital Yunlin Branch, started to use an SNS app to connect with stage 5 CKD patients and their families. In cases of emergency, patients and families could quickly report any condition to F-JY. Using this app, F-JY helped facilitate productive interactions between these patients and the health care system. The intention was to safely delay the initiation of dialysis therapy. We divided patients into four groups: group 1 (G1) included patients at the study hospital during the 2007-2014 period who had contact only with nephrologists other than F-JY; group 2 (G2) included patients who visited F-JY during the 2007-2014 period before he began using the SNS app; group 3 (G3) included patients who visited nephrologists other than F-JY during the 2014-2017 period and had no interactions using the SNS; and group 4 (G4) included patients who visited F-JY during the 2014-2017 period and interacted with him using the SNS app.Results: We recruited 209 patients with stage 5 CKD who had been enrolled in the study hospital’s CKD program between 2007 and 2017. Each of the four groups initiated dialysis at different times. Before adjusting for baseline estimated glomerular filtration rate (eGFR), the G4 patients had a longer time to dialysis (mean 761.7 days, SD 616.2 days) than the other groups (G1: mean 403.6 days, SD 409.4 days, P=.011 for G4 vs G1; G2: 394.8 days, SD 318.8 days, P=.04; G3: 369.1 days, SD 330.8 days, P=.049). After adjusting for baseline eGFR, G4 had a longer duration for each eGFR drop (mean 84.8 days, SD 65.1 days) than the other groups (G1: mean 43.5 days, SD 45.4 days, P=.005; G2: mean 42.5 days, SD 26.5 days, P=.03; G3: mean 3.8.7 days, SD 33.5 days, P=.002).Conclusions: The use of an SNS app between patients with stage 5 CKD and their physicians can reduce the communication gap between them and create benefits such as prolonging time-to-dialysis initiation. The role of SNSs and associated care models should be further investigated in a larger population."
Easier and Faster Is Not Always Better: Grounded Theory of the Impact of Large-Scale System Transformation on the Clinical Work of Emergency Medicine Nurses and Physicians,"Elaine Merle Zibrowski, Lisa Shepherd, Kamran Sedig, Richard Booth, Candace Gibson",JMIR Hum Factors 2018;5(4):e11013,"Background: The effectiveness of Lean Thinking as a quality improvement method for health care has been contested due, in part, to our limited contextual understanding of how it affects the working conditions and clinical workflow of nurses and physicians. Although there are some initial indications, arising from prevalence surveys and interviews, that Lean may intensify work performed within medical environments, the evidence base still requires detailed descriptions of the changes that were actually introduced to individuals’ clinical workflow and how these changes impacted health care professionals.Objective: The aim of this study was to explore ways in which a Lean intervention may impact the clinical work of emergency medicine nurses and physicians.Methods: We used a realist grounded theory approach to explore the clinical work of nurses and physicians practicing in 2 emergency medicine departments from a single teaching hospital in Canada. The hospital has 1000 beds with 128,000 emergency department (ED) visits annually. In 2013, both sites began a large-scale, Lean-driven system transformation of their practice environments. In-person interviews were iteratively conducted with health care professionals from July to December 2017. Information from transcripts was coded into categories and compared with existing codes. With repeated review of transcripts and evolving coding, we organized categories into themes. Data collection continued to theoretical sufficiency.Results: A total of 15 emergency medicine nurses and 5 physicians were interviewed. Of these, 18 individuals had practiced for at least 10 years. Our grounded theory involved 3 themes: (1) organization of our clinical work, (2) pushed pace in the front cell, and (3) the toll this all takes on us. Although the intervention was supposed to make the EDs work easier, faster, and better, the participants in our study indicated that the changes made had the opposite impact. Nurses and physicians described ways in which the reconfigured EDs disrupted their established practice routines and resulted in the intensification of their work. Participants also identified indications of deskilling of nurses’ work and how the new push-forward model of patient care had detrimental impacts on their physical, cognitive, and emotional well-being.Conclusions: To our knowledge, this is the first study to describe the impact of Lean health care on the working conditions and actual work of emergency medicine nurses and physicians. We theorize that rather than support health care professionals in their management of the complexities that characterize emergency medicine, the physical and process-based changes introduced by the Lean intervention acted to further complicate their working environment. We have illuminated some unintended consequences associated with accelerating patient flow on the clinical workflow and perceived well-being of health care professionals. We identify some areas for reconsideration by the departments and put forward ideas for future research."
Blockchain Technology for Detecting Falsified and Substandard Drugs in Distribution: Pharmaceutical Supply Chain Intervention,"Patrick Garcia Sylim, Fang Liu, Alvin Marcelo, Paul Fontelo",JMIR Res Protoc 2018;7(9):e10163,"Background: Drug counterfeiting is a global problem with significant risks to consumers and the general public. In the Philippines, 30% of inspected drug stores in 2003 were found with substandard/spurious/falsely-labeled/falsified/counterfeit drugs. The economic burden on the population drug expenditures and on governments is high. The Philippine Food and Drug Administration (FDA) encourages the public to check the certificates of product registration and report any instances of counterfeiting. The National Police of Philippines responds to such reports through a special task force. However, no literature on its impact on the distribution of such drugs were found. Blockchain technology is a cryptographic ledger that is allegedly immutable through repeated sequential hashing and fault-tolerant through a consensus algorithm. This project will develop and test a pharmacosurveillance blockchain system that will support information sharing along the official drug distribution network.Objective: This study aims to develop a pharmacosurveillance blockchain system and test its functions in a simulated network.Methods: We are developing a Distributed Application (DApp) that will run on smart contracts, employing Swarm as the Distributed File System (DFS). Two instances will be developed: one for Ethereum and another for Hyperledger Fabric. The proof-of-work (PoW) consensus algorithm of Ethereum will be modified into a delegated proof-of-stake (DPoS) or practical Byzantine fault tolerance (PBFT) consensus algorithm as it is scalable and fits the drug supply chain environment. The system will adopt the GS1 pedigree standard and will satisfy the data points in the data standardization guidelines from the US FDA. Simulations will use the following 5 nodes: for FDA, manufacturer, wholesaler, retailer, and the consumer portal.Results: Development is underway. The design of the system will place FDA in a supervisory data verification role, with each pedigree type–specific data source serving a primary data verification role. The supply chain process will be initiated by the manufacturer, with recursive verification for every transaction. It will allow consumers to scan a code printed on the receipt of their purchases to review the drug distribution history.Conclusions: Development and testing will be conducted in a simulated network, and thus, results may differ from actual practice. The project being proposed is disruptive; once tested, the team intends to engage the Philippine FDA to discuss implementation plans and formulate policies to facilitate adoption and sustainability.registered-report: RR1-10.2196/10163"
Blockchain-Authenticated Sharing of Genomic and Clinical Outcomes Data of Patients With Cancer: A Prospective Cohort Study,"Benjamin Scott Glicksberg, Shohei Burns, Rob Currie, Ann Griffin, Zhen Jane Wang, David Haussler, Theodore Goldstein, Eric Collisson",J Med Internet Res 2020;22(3):e16810,"Background: Efficiently sharing health data produced during standard care could dramatically accelerate progress in cancer treatments, but various barriers make this difficult. Not sharing these data to ensure patient privacy is at the cost of little to no learning from real-world data produced during cancer care. Furthermore, recent research has demonstrated a willingness of patients with cancer to share their treatment experiences to fuel research, despite potential risks to privacy.Objective: The objective of this study was to design, pilot, and release a decentralized, scalable, efficient, economical, and secure strategy for the dissemination of deidentified clinical and genomic data with a focus on late-stage cancer.Methods: We created and piloted a blockchain-authenticated system to enable secure sharing of deidentified patient data derived from standard of care imaging, genomic testing, and electronic health records (EHRs), called the Cancer Gene Trust (CGT). We prospectively consented and collected data for a pilot cohort (N=18), which we uploaded to the CGT. EHR data were extracted from both a hospital cancer registry and a common data model (CDM) format to identify optimal data extraction and dissemination practices. Specifically, we scored and compared the level of completeness between two EHR data extraction formats against the gold standard source documentation for patients with available data (n=17).Results: Although the total completeness scores were greater for the registry reports than those for the CDM, this difference was not statistically significant. We did find that some specific data fields, such as histology site, were better captured using the registry reports, which can be used to improve the continually adapting CDM. In terms of the overall pilot study, we found that CGT enables rapid integration of real-world data of patients with cancer in a more clinically useful time frame. We also developed an open-source Web application to allow users to seamlessly search, browse, explore, and download CGT data.Conclusions: Our pilot demonstrates the willingness of patients with cancer to participate in data sharing and how blockchain-enabled structures can maintain relationships between individual data elements while preserving patient privacy, empowering findings by third-party researchers and clinicians. We demonstrate the feasibility of CGT as a framework to share health data trapped in silos to further cancer research. Further studies to optimize data representation, stream, and integrity are required."
