title,author,company,abstract
Early User Centered Insights on Voice Integrated Technologies Through Retrospective Analysis,"Marty Coyne, Colby Thomas, Ashley Collimore, Chris Franzese, Charles Hwang",iproc 2017;3(1):e49,"Background: There is increasing interest in incorporating voice-activated technology (VAT), such as Amazon Alexa, Google Home, and Microsoft Cortana, into the existing connected health, mHealth, and mobile medical app ecosystems. VATs allow for natural-language interactions and offer patients the promise of increased usability, greater engagement, and improved adherence to treatments and/or medications. Despite this interest, there is little ethnographic data on patients’ use of VAT or unmet needs. This data is critical to developing VAT applications that interact with medical devices, where regulatory or design control considerations require a higher level of rigor compared to unregulated consumer applications. As first-mover, Amazon Alexa technology has dominated the VAT market; customer reviews of Alexa-enabled devices outnumber the next closest technology 19 to 1. We hypothesized that Amazon Alexa was a good proxy for VAT users at large, and that systematic coding and analysis of 95,000 reviews for Amazon Alexa devices could provide insights that would accelerate follow-on research efforts to support development of user-centered VAT applications for connected health.Objective: Primarily, we sought to explore whether Amazon reviews could be used to develop initial research hypotheses, pain points, and user insights, in much the same way complaint reviews inform early development of medical devices and interventions. Secondarily, we explored whether VAT reviews could be used to identify unmet needs around VAT-for-healthcare applications.Methods: We conducted an exploratory, manual retrospective analysis of 28,271 full-text user reviews for Amazon’s Echo and Dot devices, including all reviews from February to July 2017. This represented approximately 31% of all available Amazon Alexa review data. Two authors (CT/AC) screened each review for relevance, defined as any mention of an issue related to use, misuse, unintended/unexpected event, or novel application of technology. Relevant reviews were manually coded by the authors into one or more of nine categories.Results: There were 284/28,271 user reviews (~1%) that were relevant, yielding valuable user-related insights in our areas of interest. Most relevant reviews focused on Healthcare-Related Workarounds (141), Quality of Life Improvement (159), and Physical Disability (93). We also found relevant, useful information related to Neurological Disorder/Disability (39), Unauthorized Interactions (23), Unexpected Use Settings (33), Natural Language Barriers/Advantages (50), Companionship (50), and Noteworthy Benefits to Healthcare (16). We found the reviews to contain significant detail, allowing us to generate initial insights without the expenditure and complexity of traditional user research.Conclusions: The results of our manual review and coding provided unexpectedly rich information regarding unique device uses, curious workarounds, and unexpected complications. This analysis offers an early effort to improve understanding of how this type of technology may be used in the medical field. Given the currently sparse literature in this space, our study provides a roadmap for future studies centered around VATs in digital health. All remaining reviews should be similarly analyzed and catalogued for future use. Such investigations could involve more detailed exploration of patient practices using other user research methods in order to inform future development in this area."
My Hypertension Education and Reaching Target (MyHEART): Development and Dissemination of a Patient-Centered Website for Young Adults with Hypertension,"Heather M M Johnson, Jamie N LaMantia, Colleen M Brown, Ryan C Warner, Laura M Zeller, Ryan C Haggart, Keven Stonewall, Diane R Lauver",JMIR Cardio 2017;1(2):e5,"Background: Young adults (18 to 39 years old) with hypertension have the lowest rates of blood pressure control (defined as blood pressure less than 140/90 mmHg) compared to other adult age groups. Approximately 1 in 15 young adults have high blood pressure, increasing their risk of future heart attack, stroke, congestive heart failure, and/or chronic kidney disease. Many young adults reported having few resources to address their needs for health education on managing cardiovascular risk.Objective: The goal of our study was to develop and disseminate a website with evidence-based, clinical information and health behavior resources tailored to young adults with hypertension.Methods: In collaboration with young adults, health systems, and community stakeholders, the My Hypertension Education and Reaching Target (MyHEART) website was created. A toolkit was also developed for clinicians and healthcare systems to disseminate the website within their organizations. The dissemination plan was guided by the Dissemination Planning Tool of the Agency for Healthcare Research and Quality (AHRQ).Results: Google Analytics data were acquired for January 1, 2017 to June 29, 2017. The MyHEART website received 1090 visits with 2130 page views; 18.99% (207/1090) were returning visitors. The majority (55.96%, 610/1090) approached the website through organic searches, 34.95% (381/1090) accessed the MyHEART website directly, and 5.96% (65/1090) approached through referrals from other sites. There was a spike in site visits around times of increased efforts to disseminate the website.Conclusions: The successfully implemented MyHEART website and toolkit reflect collaborative input from community and healthcare stakeholders to provide evidence-based, portable hypertension education to a hard-to-reach population. The MyHEART website and toolkit can support healthcare providers’ education and counseling with young adults and organizations’ hypertension population health goals."
The Internet Healthcare Coalition,John Mack,J Med Internet Res 2000;2(1):e3,Abstract is not available
Integrated Models of Care for People Living with Hepatitis C Virus and a Substance Use Disorder: Protocol for a Systematic Review,"Lianping Ti, Stephanie Parent, María Eugenia Socías",JMIR Res Protoc 2018;7(5):e122,"Background: People living with a substance use disorder (SUD) are a key population within the hepatitis C virus (HCV) epidemic. While integrated and community-based models of care have shown positive outcomes among this population, the literature has been primarily focused on the HIV context. This paper outlines a systematic review protocol on the impact of various integrated models of care, which includes HCV and SUD services, on various treatment, and health-related outcomes among this population.Objective: The objective of this review is to determine the impact of integrated models of care on HCV and addiction treatment and health-related outcomes for adults living with HCV and an SUD.Methods: We will search 5 databases, article reference lists, and abstracts from relevant conferences that investigate the impact of integrated models of care on treatment and health-related outcomes among people living with HCV and an SUD. Database searches will be conducted and titles, abstracts, and the full-text of the relevant studies will be independently reviewed in separate stages. The methodological quality of included studies will be assessed using a validated tool. Data from included articles will be extracted using a standardized form and synthesized in a narrative account.Results: For this project, we have received funding from the Canadian Institute of Health Research. To date, we have completed the search strategy, reviewed the titles, abstracts, and full-texts. Grading the selected studies and qualitative synthesis of the results are currently under way, and we expect the final results to be submitted for publication in the fall of 2018.Conclusions: The systematic review will describe different integrated models of care that could be effective in improving the health and well-being of people living with HCV and an SUD. Results of this review could also identify quality improvement strategies to minimize the health and cost burden imposed on patients, healthcare professionals, and the healthcare system.Trial Registration: PROSPERO CRD42017078445; https://www.crd.york.ac.uk/prospero/display_record.php?RecordID=78445 (Archived by WebCite at http://www.webcitation.org/6z4YnkE9G)"
Healthcare Cost Analysis of Older Patients Using a Personal Emergency Response Service Uncovers Costs Savings Opportunity,"Mariana Simons, Sara Golas, Stephen Agboola, Jorn op den Buijs, Nils Fischer, Jennifer Felsted, Linda Schertzer",iproc 2017;3(1):e26,"Background: In the US healthcare system, half of overall Medicare and Medicaid Services reimbursement goes towards caring for the top 5% most expensive patients. However, little is known about how these patients' costs change annually prior to them reaching the top 5%. To address these gaps and investigate potential cost savings opportunities, we analyzed patient flow and associated healthcare cost trends over the period 2011-2015.Objective: To evaluate longitudinal trends in healthcare cost of older patients using Personal Emergency Response Service (PERS).Methods: This is a retrospective, longitudinal, multicenter study to evaluate healthcare cost of 2,643 older patients over the period 2011-2015. All patients had at least one inpatient and/or outpatient encounter, and at least one episode of home health care during the study period. In addition, all patients used PERS at home anytime during the study period. The study population was segmented by their annual healthcare expenditures into Top (5%), Middle (6-50%) and Bottom (51-100%) segments. Cost acuity pyramids were built based on these segments for each fiscal year. The longitudinal healthcare expenditure trends of the complete study population, as well as each segment, were assessed by linear regression models. Patient flows throughout the segments of the cost acuity pyramids from year to year were modeled by Markov chains. The associated costs flows were quantified over a 2-year period.Results: Total healthcare cost of the study population nearly doubled from $17.7M in 2011 to $33.0M in 2015. This increasing trend was statistically significant (P=0.003) with an expected yearly cost increase of $3.6M. This growth was driven by a significantly higher cost increase in the Middle segment ($2.3M; P=0.002). The expected yearly costs increase of the Top and Bottom segments was $1.2M (P=0.008) and $0.1M (P=0.003) respectively, and both were statistically significant. The patients and cost flow analyses showed that 18% of patients moved up the cost acuity pyramid yearly, and their cost increased by 672% in contrast to 22% of patients who moved down with a cost decrease by 86%. The remaining 60% of patients stayed in the same segment from year to year, but their cost increased by 18%.Conclusions: While many healthcare organizations target costly intensive interventions for their most expensive patients, this analysis unveiled a potential cost savings opportunity by managing the patients in the lower cost segments that are at risk of moving up the cost acuity pyramid. To achieve this, data analytics that integrate longitudinal data from the EHR and home monitoring devices may help healthcare organizations to optimize resources by enabling clinicians to proactively manage patients in their home or community environments, beyond institutional settings and 30-60 day telehealth services."
Using Social Media to Generate and Collect Primary Data: The #ShowsWorkplaceCompassion Twitter Research Campaign,"Wendy Clyne, Sally Pezaro, Karen Deeny, Rosie Kneafsey",JMIR Public Health Surveill 2018;4(2):e41,"Background: Compassion is a core value embedded in the concept of quality in healthcare. The need for compassion toward healthcare staff in the workplace, for their own health and well-being and also to enable staff to deliver compassionate care for patients, is increasingly understood. However, we do not currently know how healthcare staff understand and characterize compassion toward themselves as opposed to patients.Objective: The aim of this study was to use social media for the generation and collection of primary data to gain understanding of the concept of workplace compassion.Methods: Tweets that contained the hashtag #ShowsWorkplaceCompassion were collected from Twitter and analyzed. The study took place between April 21 and May 21, 2016. Participants were self-selecting users of the social media service Twitter. The study was promoted by a number of routes: the National Health Service (NHS) England website, the personal Twitter accounts of the research team, internal NHS England communications, and via social media sharing. Participants were asked to contribute their views about what activities, actions, policies, philosophies or approaches demonstrate workplace compassion in healthcare using the hashtag #ShowsWorkplaceCompassion. All tweets including the research hashtag #ShowsWorkplaceCompassion were extracted from Twitter and studied using content analysis. Data concerning the frequency, nature, origin, and location of Web-based engagement with the research campaign were collected using Bitly (Bitly, Inc, USA) and Symplur (Symplur LLC, USA) software.Results: A total of 260 tweets were analyzed. Of the 251 statements within the tweets that were coded, 37.8% (95/251) of the statements concerned Leadership and Management aspects of workplace compassion, 29.5% (74/251) were grouped under the theme related to Values and Culture, 17.5% (44/251) of the statements related to Personalized Policies and Procedures that support workplace compassion, and 15.2% (38/251) of the statements concerned Activities and Actions that show workplace compassion. Content analysis showed that small acts of kindness, an embedded organizational culture of caring for one another, and recognition of the emotional and physical impact of healthcare work were the most frequently mentioned characteristics of workplace compassion in healthcare.Conclusions: This study presents a new and innovative research approach using Twitter. Although previous research has analyzed the nature and pattern of tweets retrospectively, this study used Twitter to both recruit participants and collect primary data."
"Assessment of Immunization Session Practices in Primary Healthcare Centers - Wasit Province, Iraq, 2016-17","Ali Amily, F Lami",iproc 2018;4(1):e10622,"Background: Annually, vaccines prevent more than 2.5 million child deaths globally. WHO and UNICEF estimates of immunization coverage in Iraq in 2016 revealed 63% for DTP3 and 66% for MCV1. Wasit is among governorates with a large number of under-immunized children, opening the door for many future outbreaks. Immunization session practices (ISPs), when maintained of high-quality, can ensure safer and more effective vaccination as well as higher coverage rates.Objective: The objective of this study was to assess ISPs in Primary Healthcare Centers (PHCs) in Wasit province.Methods: We conducted this cross-sectional study on 24(44%) PHCs in Wasit province, selected by simple random sampling. Based on WHO and the national guidelines, checklists were developed to assess 58 ISPs that were grouped into seven domains: vaccine and diluent management, cold chain management, session’s equipment, communication with clients and caregivers, vaccine preparation and administration, card review and registration and waste management. The score (out of 100%) was calculated for each domain in all selected PHCs, then the average for all domains was calculated in each PHC. The assessment was made by direct on-job observation of immunization sessions, through a single visit conducted to each PHC.Results: PHCs were ranging in their ISPs: 52-78%; with a mean of 67% (±8%). The highest scores were for the following domains: session’s equipment (88%), waste management (82%) and card review and registration (81%). The least achieving domains were: communication with clients and caregivers (36%) and cold chain management (38%). Vaccine preparation and administration was scoring 69%, whereas the score for vaccine and diluent management was only 50%.Conclusions: ISPs practiced in PHCs in Wasit province were far from the standard. National Expanded Program on Immunization should work on raising the capacity of vaccinators, particularly their communication skills with the clients and caregivers and the management of vaccines and cold chain."
My Team of Care Study: A Pilot Randomized Controlled Trial of a Web-Based Communication Tool for Collaborative Care in Patients With Advanced Cancer,"Teja Voruganti, Eva Grunfeld, Trevor Jamieson, Allison M Kurahashi, Bhadra Lokuge, Monika K Krzyzanowska, Muhammad Mamdani, Rahim Moineddin, Amna Husain",J Med Internet Res 2017;19(7):e219,"Background: The management of patients with complex care needs requires the expertise of health care providers from multiple settings and specialties. As such, there is a need for cross-setting, cross-disciplinary solutions that address deficits in communication and continuity of care. We have developed a Web-based tool for clinical collaboration, called Loop, which assembles the patient and care team in a virtual space for the purpose of facilitating communication around care management.Objective: The objectives of this pilot study were to evaluate the feasibility of integrating a tool like Loop into current care practices and to capture preliminary measures of the effect of Loop on continuity of care, quality of care, symptom distress, and health care utilization.Methods: We conducted an open-label pilot cluster randomized controlled trial allocating patients with advanced cancer (defined as stage III or IV disease) with ≥3 months prognosis, their participating health care team and caregivers to receive either the Loop intervention or usual care. Outcome data were collected from patients on a monthly basis for 3 months. Trial feasibility was measured with rate of uptake, as well as recruitment and system usage. The Picker Continuity of Care subscale, Palliative care Outcomes Scale, Edmonton Symptom Assessment Scale, and Ambulatory and Home Care Record were patient self-reported measures of continuity of care, quality of care, symptom distress, and health services utilization, respectively. We conducted a content analysis of messages posted on Loop to understand how the system was used.Results: Nineteen physicians (oncologists or palliative care physicians) were randomized to the intervention or control arms. One hundred twenty-seven of their patients with advanced cancer were approached and 48 patients enrolled. Of 24 patients in the intervention arm, 20 (83.3%) registered onto Loop. In the intervention and control arms, 12 and 11 patients completed three months of follow-up, respectively. A mean of 1.2 (range: 0 to 4) additional healthcare providers with an average total of 3 healthcare providers participated per team. An unadjusted between-arm increase of +11.4 was observed on the Picker scale in favor of the intervention arm. Other measures showed negligible changes. Loop was primarily used for medical care management, symptom reporting, and appointment coordination.Conclusions: The results of this study show that implementation of Loop was feasible. It provides useful information for planning future studies further examining effectiveness and team collaboration. Numerically higher scores were observed for the Loop arm relative to the control arm with respect to continuity of care. Future work is required to understand the incentives and barriers to participation so that the implementation of tools like Loop can be optimized.Trial Registration: ClinicalTrials.gov NCT02372994; https://clinicaltrials.gov/ct2/show/NCT02372994 (Archived by WebCite at http://www.webcitation.org/6r00L4Skb)."
A Smartphone Attention Bias Intervention for Individuals With Addictive Disorders: Protocol for a Feasibility Study,"Melvyn Wb Zhang, Jiangbo Ying, Syidda B Amron, Zaakira Mahreen, Guo Song, Daniel SS Fung, Helen Smith",JMIR Res Protoc 2018;7(11):e11822,"Background: Substance use disorders are highly prevalent globally. Relapse rates following conventional psychological interventions for substance use disorders remain high. Recent reviews have highlighted attentional and approach or avoidance biases to be responsible for multiple relapses. Other studies have reported the efficacy of interventions to modify biases. With advances in technologies, there are now mobile versions of conventional bias modification interventions. However, to date, no study has evaluated bias modification in a substance-using, non-Western sample. Existing evaluations of mobile technologies for the delivery of bias interventions are also limited to alcohol or tobacco use disorders.Objective: This study aims to examine the feasibility of mobile-based attention bias modification intervention among treatment-seeking individuals with substance use and alcohol use disorders.Methods: This is a feasibility study, in which inpatients who are in their rehabilitation phase of clinical management will be recruited. On each day that they are in the study, they will be required to complete a craving visual analogue scale and undertake both a visual probe-based assessment and and modification task in a smartphone app . Reaction time data will be collated for the computation of baseline attentional biases and to determine whether there is a reduction of attentional bias across the interventions. Feasibility will be determined by the number of participants recruited and participants’ adherence to the planned interventions up until the completion of their rehabilitation program and by the ability of the app in detecting baseline biases and changes in biases. Acceptability of the intervention will be assessed by a short questionnaire of users’ perceptions of the intervention. Statistical analyses will be performed using SPSS version 22.0, while qualitative analysis of the perspectives will be performed using NVivo version 10.0.Results: This study was approved by the National Healthcare Group Domain Specific Research Board, with approval number (2018/00316). Results will be disseminated by means of conferences and publications.Currently, we are in the process of recruitment for this study.Conclusions: To the best of our knowledge, this is the first study to evaluate the feasibility and acceptability of a mobile attention bias modification intervention for individuals with substance use disorders. The data pertaining to the feasibility and acceptability are undoubtedly crucial because they imply the potential use of mobile technologies in retraining attentional biases among inpatients admitted for medical-assisted detoxification and rehabilitation. Participants’ feedback pertaining to the ease of use, interactivity, and motivation to continue using the app is crucial because it will determine whether a codesign approach might be warranted to design an app that is acceptable for participants and that participants themselves would be motivated to use.registered-report: PRR1-10.2196/11822"
